steamid,num_games_owned,num_reviews,playtime_forever(min),playtime_last_two_weeks(min),playtime_at_review(min),last_played,recommendationid,language,review,timestamp_created,timestamp_updated,voted_up,votes_up,votes_funny,weighted_vote_score,comment_count,steam_purchase,received_for_free,written_during_early_access,hidden_in_steam_china,steam_china_location,review_length,review_updated,timestamp_dev_responded, developer_response
76561198035785880,395,28,632,0,632,2022-11-22 11:34:06,125910365,english,I thought I'd enjoy the game but it's just not for me. I'm all for wasting time but its not like there's even any fun to it， the game just goes in circles on and on SLOWLY accumulating wealth and stats， and bogging you down with "Seasonal" stuff that you can't develop any real counter to unless you change the values of warmups and lifetimes of， in the game files themselves， to keep some sanity you'd lose playing this game.;;Everything takes forever to do， taking up valuable time and usually action tiles you NEED to counter something right this second. There's loads of attributes or stats on all the cards that give you some sense that there's some deeper meaning or lore to the game， and there is， but good luck ever getting there by the time your grandkids are born. God forbid you die， which is likely to happen given the consistent depression you go into， or blind insanity.;;I tried playing the dancer， I was actually interested in this weird evolution ordeal. Then the save got corrupted cuz of an update. Fantastic， I'm back to an Aspirant being a Glover and Glover bootlicker. I guess you're supposed to accumulate this lore after spending Funds at a book store， studying them and dreaming in The Wood for chances at getting cards that might do something if you're lucky， and this lore helps your "Cult" that will fail somehow? Notoriety stacks like crazy and if you dare do ANYTHING you'll generate it constantly， so you're bound to fail anyway.;;There's no... direction. There's no point. I'm trapped farming gold for Glover and Glover， not doing anything with my Cult because some Detective either constantly sticks nothing at me when I do nothing with zero evidence， or has a field day with existing Notoriety because I wanted to make a contact， running circles in The Woods expecting a different outcome， and collecting Lore that I'll lose because no shit. This taking HOURS to do， by the way. I get that there's no tutorial， I get this is a trial and error game， but when the trials take a good 4 hours of my time to get any significant progress (and accumulation of stats and lore doesn't feel like it) and the errors are attempting to do so in any capacity whatsoever， it just feels like a shallow game that acts like its super deep.;;Magnetism happening at the very start of a tile's spawn/cycle is a travesty. Whats that? You're down to your last coin and your Dream tile is almost done， and you need to spend money on sleeping because your character has 4 different despair cards and will kill themselves if they don't get a smidgen of happiness? Oops， Time card's done， consuming its previous already stored coin. It'll just steal that out of your hands thank you very much you're dead now. You could have gotten the Funds from your job， if you had that 20 seconds of depression covered from spending 10 seconds sleeping with your money. By the way， as a "reaction" to despair， it takes forever to do. ;;The game feels slow， the game feels obtuse and clunky. And it sure as shit doesn't feel fun. Go watch playthroughs， or go read up on the lore on a wiki， it'll save you the headache of playing this game. Why don't I look up a tutorial for this game? Well you see， having to watch a person spend 4 hours avoiding the frustrations of this game just to get a step further than you is even more exhausting than doing it manually.,2022-11-22 11:54:18,2022-11-22 11:56:47,False,6,0,0.505303740501403809,0,True,False,False,True,,3354,True,,
76561198851798523,214,12,2385,0,1165,2022-12-09 06:37:47,125884752,schinese,好游戏，汉化质量也是杠杠滴,2022-11-22 00:47:00,2022-11-22 00:47:00,True,0,0,0,0,True,False,False,True,,13,False,,
76561197987654526,1161,5,461,0,461,2018-06-22 23:52:35,125871163,english,A) Game punishes you all the time for not knowing what shit would happen in the future， leading you to have to restart because of some shit you had no way of knowing. Once might be a cute trick， that being a core loop is just frustrating， given how much busywork goes into the game.;B) Dude who made it is a sex pest.;;Do not recommend.,2022-11-21 19:11:13,2022-11-21 19:11:13,False,3,0,0.523809552192687988,1,True,False,False,True,,336,False,2022-11-22 18:47:19,Hey there， sorry you didn't enjoy the game! We'll see if we can improve in our next one... :);;However， please don't undermine your legitimate critique with disproven personal slurs. One of the devs on this game *was* accused of misconduct， on Twitter， three years ago. Several exhaustive third-party investigations found those accusations baseless. You can read the most recent one here (https://the-failbetter-report.com/) and the dev's own words here (https://weatherfactory.biz/failgate/). ;;It's hurtful to spread disproven allegations around. Please don't! Thank you.
76561199147140922,15,3,976,0,960,2023-01-07 22:40:52,125870884,schinese,我认为这是一款带有克苏鲁气息的游戏，背景非常的宏达，可以细细推敲出很多内容。对新手不是很友好，需要在不断地游戏中才能知道某些牌的具体用处。五星推荐啦。,2022-11-21 19:02:23,2022-11-21 19:02:23,True,0,0,0,0,True,False,False,True,,75,False,,
76561198046800609,265,7,2801,0,1966,2023-01-15 11:00:16,125861249,english,very fun like sacrificing cult member,2022-11-21 13:25:38,2022-11-21 13:25:38,True,0,1,0,0,False,False,False,True,,37,False,,
76561198090192317,229,34,1281,0,950,2022-11-29 22:09:51,125749456,english,Died of dread due to not knowing any better.;Died of dread due to not paying attention.;The somewhat random system that prioritizes intaking dread instead of contentment， the only contentment expired， dream action was on cooldown， died of dread YET AGAIN.;;Just when I thought I was making tons of progress， ;died of dread due to the dread box got pushed out of the map by tons of other stuffs.;;Died of dread IRL.;;Conclusion: Buy the game and suffer with me.;,2022-11-19 20:35:08,2022-11-19 20:35:08,True,0,1,0,0,True,False,False,True,,461,False,,
76561198272128065,217,48,715,0,715,2022-11-18 03:39:43,125742679,english,I have no idea how to play this game but all I know is I am having fun bashing my head against a wall.,2022-11-19 18:08:58,2022-11-19 18:08:58,True,0,1,0,0,True,False,False,True,,102,False,,
76561198834621517,84,31,1587,0,1587,2022-11-17 14:48:23,125686617,schinese,好玩的，这种疯狂打工供养所有教徒的感觉真是令人着迷,2022-11-18 21:14:20,2022-11-18 21:14:20,True,0,0,0,0,False,False,False,True,,27,False,,
76561199114041256,26,1,6310,0,3562,2023-03-25 01:26:47,125675310,english,I had a great time with this one， the story was interesting but not particularly compelling and the game play was very enjoyable and satisfying. Loved the music and the atmosphere， if i had one complaint it would be that it is easy to lose track of Ill Health cards leading to a quick game over. For me its probably a 7/10.,2022-11-18 16:20:49,2022-11-18 16:20:49,True,0,0,0,1,True,False,False,True,,323,False,,
76561199431026400,10,2,562,0,293,2022-11-21 23:29:59,125616321,schinese,自由度，虽然太难了,2022-11-17 17:09:37,2022-11-17 17:09:37,True,0,0,0,0,True,False,False,True,,9,False,,
76561198389288935,92,25,1343,0,954,2022-11-22 15:56:30,125615859,schinese,非常繁琐，非常套路化，非常辛苦，长期机械化重复工作。很难有重玩价值，但推荐玩一两局了解一下故事和设定。,2022-11-17 16:55:33,2022-11-17 16:55:33,True,1,0,0.523809552192687988,0,True,False,False,True,,51,False,,
76561198171072353,105,5,9481,0,9481,2022-11-11 09:45:30,125597624,english,A game that doesn't hold your hand， Cultist Simulator not just encourages， but requires exploration and trying new things. With essentially no tutorial， expect to perish quite a bit until you figure out the general game flow. Primarily text based， you figure out your next step through puzzling over the lore of the cards (or if you're cheeky by checking the wiki). This is a game that WILL punish failure and poor resource management， but it will also reward critical thinking and logical inference. With interesting lore and captivating writing， this is a game will initially frustrate but captivate you， and after your first "a ha!" moment you'll be hooked for hours to come.,2022-11-17 07:37:31,2022-11-17 07:37:31,True,0,0,0,0,True,False,False,True,,678,False,,
76561197996371480,715,21,1547,0,1547,2021-04-01 22:04:44,125576612,english,Keep coming back to it,2022-11-16 23:41:12,2022-11-16 23:41:12,True,0,0,0,0,True,False,False,True,,22,False,,
76561198067238023,313,30,831,0,804,2022-11-19 04:04:54,125554405,english,I am AWFUL at this game， and it is still super fun. The writing is great， the art is fantastic and the lore is extensive， bountiful， and terrible. ;It is a juggling game of timers， it makes you pay attention and plan and makes smart moves， well， to ascend.;I guess it is a card/board game. If the board game has completely lost its mind and decided to haunt the neighbours. But in a good way?,2022-11-16 11:47:03,2022-11-16 11:47:26,True,0,0,0,0,True,False,False,True,,392,True,,
76561199028996340,47,4,406,0,248,2022-11-30 13:11:19,125524186,schinese,太香了！喜欢！,2022-11-15 22:29:36,2022-11-15 22:29:36,True,0,0,0,0,True,False,False,True,,7,False,,
76561198321138388,272,42,2698,0,2533,2022-11-16 02:57:24,125502166,schinese,仓鼠党狂喜的游戏，如文明般下一回合的体验。,2022-11-15 10:11:13,2022-11-15 10:11:13,True,0,0,0,0,True,False,False,True,,21,False,,
76561198010742139,668,130,140,0,15,2022-11-15 07:26:31,125482329,english,This is terrible.,2022-11-15 05:19:09,2022-11-15 06:21:39,False,1,0,0.481751799583435059,0,False,False,False,True,,17,True,,
76561198094696501,51,3,3081,0,617,2023-02-02 04:40:56,125410550,english,Finally bought it her after playing on the tablet for ages. Always recommend. The atmosphere is amazing， and the game play proper sucks you in， can spend hours in without even realising. Might go start a cult for real now.,2022-11-13 21:26:20,2022-11-13 21:26:20,True,0,0,0,0,True,False,False,True,,222,False,,
76561198063856697,159,7,180,0,180,2021-07-02 03:06:38,125305340,english,This is a weird one， I can recommend the game despite bouncing off it.;;[i]Cultist Simulator[/i] takes the 90s game design decision of no tutorial/learn as you go and dials it up to 11. It often feels directionless and confusing， but it does it intentionally. The writing and atmosphere are top notch and will be appreciated by anyone even vaguely interested in cosmic horror.;;The gameplay itself is largely narrative driven， with any time pressure being alleviated by simply pausing. It feels like a visual novel met the real time strategy genre.;;Ultimately [i]Cultist Simulator[/i] is... weird. I can't say for sure whether it's for you since it does not have mass appeal， but it is worth trying out since if you like it， you will love it.,2022-11-12 01:20:00,2022-11-12 01:20:00,True,0,0,0,0,True,False,False,True,,743,False,,
76561198433543333,103,68,176,0,176,2022-11-11 21:24:48,125295157,schinese,卡牌合成器;缺少引导，没有层层递进的设计。氛围做的很一般，机翻让本就云里雾里的文字更玄。;烂尾和坐牢二选其一。,2022-11-11 21:26:43,2022-11-11 21:27:31,False,4,1,0.435957193374633789,0,False,False,False,True,,55,True,,
76561198358926744,214,12,2007,0,1976,2023-01-14 15:58:00,125286427,schinese,光汉化质量就值这个好评,2022-11-11 16:50:55,2022-11-11 16:50:55,True,13,0,0.617612957954406738,0,False,False,False,True,,11,False,,
76561198068514709,505,13,1347,0,1347,2022-10-31 16:50:09,125280248,english,Hours of grind for a paragraph of text that I don't even want to read anymore， because I turned my brain off.,2022-11-11 12:48:05,2022-11-11 12:48:05,False,2,0,0.52173912525177002,1,True,False,False,True,,109,False,,
76561198101788248,31,1,11390,0,2382,2023-03-22 12:04:46,125279870,schinese,我要当教主！,2022-11-11 12:35:21,2022-11-11 12:35:21,True,0,0,0,0,True,False,False,True,,6,False,,
76561198304646971,39,7,2393,0,1961,2022-11-12 18:57:32,125216389,english,Cultist Simulator is unforgiving but also addicting. After 30 hours I think I'm starting to know what I'm doing - and then I die once again before getting more than a level four lore. Recommended if you don't mind a little grind with a lot of dying.,2022-11-10 04:00:55,2022-11-10 04:00:55,True,0,0,0,0,True,False,False,True,,249,False,,
76561198103406570,82,7,2761,0,1288,2023-02-04 16:20:46,125208141,schinese,很有代入感，当我游戏里吓死了三次的时候，看到绝望滋生的面具图标就真的开始害怕了。,2022-11-10 00:33:34,2022-11-10 00:33:34,True,0,0,0,0,True,False,False,True,,40,False,,
76561199201071146,13,2,4493,0,2570,2022-11-25 21:31:26,125203986,schinese,好玩，我是打工头子,2022-11-09 22:48:17,2022-11-09 22:48:17,True,0,0,0,0,True,False,False,True,,9,False,,
76561198408236968,53,3,446,0,446,2022-11-09 17:36:36,125193723,schinese,玩不懂,2022-11-09 17:44:29,2022-11-09 17:44:29,False,0,1,0,0,True,False,False,True,,3,False,,
76561198954069369,181,11,3931,0,3931,2022-11-04 21:33:04,125189289,schinese,       纵观游戏发展，有一个明显的趋势是越来越注重“探索”两个字，大家都在往这个方面，在题材或玩法上进行着或多或少地尝试。其中，《密教》是最令我可惜的作品，离神作就差那么一步之遥。它完全放弃了引导与教程，激进地把“探索”两个字作为游戏核心玩法，以换来令人入迷的初见体验。“每一个研习诸史的人都知道，漫宿无墙。”直面风险，探索前行。你不会总是能够得知下一步该做什么。不断尝试吧。”这是你进入游戏最先看到的两句话。宏大，诡异又诱人的世界观，庞大的文本量，使玩家真正带入进去，战战兢兢，又难以自拔地从浩如烟海的书籍遗物发掘着被掩埋的历史和司辰与永生的秘密。性向，司辰，和某些设定、文本都耐人寻味，如“纷争正是这个世界的引擎”；“被赤杯饮尽的浪潮，被铸炉粉碎的燧石”，都让人浮想联翩。可成也萧何，败也萧何。把“探索”作为核心玩法使人初见时惊为天人，但多周目游玩时，玩家已摸清了设定与玩法，没有了开始时有趣的探索，就会产生大量无意义的重复劳动，使人感到疲倦。可《密教》本身偏偏是个多周目多结局的游戏，如果追求多结局或者全成就，这个问题相当致命。而最令我不解的是，AK当年是参与过《无光之海》制作的，重复度高这个问题本不该是个问题。仿照《无光之海》的继承系统，如果让教主每次胜利后，下一任教主能够继承部分教徒（熟人），或是某个低级密转或遗物，都能使这个问题得到完美解决，使《密教》成为当之无愧的神作，这难免让人遗憾。,2022-11-09 14:50:42,2022-11-09 14:50:42,True,22,0,0.705021560192108154,0,True,False,False,True,,605,False,,
76561198097968438,245,17,4722,0,1819,2023-02-13 10:52:34,125184818,english,Yeah， I really really hated this game at first， which annoyed me， since it seemed like it would be right up my alley.  But after giving it a break and coming back and trying it a few more times...I still really hate it， but in a fun， addictive way.  Some of the mechanics are so frustrating at time， especially when things sneak by you and suddenly you've lost without realizing it， but there's a huge amount of depth， and it's super fun when you find a hidden mechanic you didn't think of before,2022-11-09 12:00:40,2022-11-09 12:00:40,True,0,0,0,0,True,False,False,True,,496,False,,
76561198317846982,196,12,5504,0,5247,2023-02-01 15:48:28,125182548,schinese,遇到了一个恶性bug，新一轮开始的时候后面八九个时节的牌会突然列在桌面上，还跟其他牌不在一个图层，只能挨个拖掉，与此同时，时节里会冒出很多恐惧和入迷，看不到牌面，总数还未知，非常让人挠头。是食尸鬼dlc，而且已经进行一半了……,2022-11-09 10:49:03,2022-11-09 10:49:03,True,0,0,0,0,True,False,False,True,,113,False,,
76561199103824969,49,3,2580,0,1023,2023-01-26 11:16:03,125180614,english,in gi rum imus noc te et con sumi [b]snip snip snip[/b],2022-11-09 09:48:27,2022-11-09 09:48:27,True,0,0,0,0,True,False,False,True,,55,False,,
76561198199981463,342,37,21,0,21,2022-11-06 01:51:44,125145684,schinese,我想学习了，妈妈，学习比密教模拟器简单。,2022-11-08 18:10:10,2022-11-08 18:10:10,True,0,0,0,0,True,False,False,True,,20,False,,
76561198256088680,453,117,689,0,325,2022-11-24 00:18:46,125124550,english,There is nothing about this I understand.,2022-11-08 05:59:31,2022-11-08 05:59:31,True,0,1,0,0,True,False,False,True,,41,False,,
76561198837791266,251,4,2430,0,1228,2023-02-20 06:33:32,125122343,english,While Cultist Simulator is definitely difficult to learn， once you do learn it， you won't want to stop playing it. If you enjoy esoteric and occult lore， I would definitely recommend buying this game.,2022-11-08 05:03:10,2022-11-08 05:03:10,True,6,0,0.581863939762115479,0,True,False,False,True,,200,False,,
76561198078321351,93,8,122,0,122,2022-11-02 00:50:29,125118123,english,game seems verry fun， but its gameplay is Very Drawn out， and takes along time to get anything done. unless you have the alot of patience， do not recomend,2022-11-08 03:18:46,2022-11-08 03:18:46,False,13,1,0.59062880277633667,0,True,False,False,True,,154,False,,
76561198010418156,699,99,54,0,54,2021-12-12 12:17:51,125108074,english,This is a beautiful game and truly the product of a spirited mind which is reflected in the product as a whole.;I believe that everything from the music to the art and story of the game is all in perfect balance and really sells the game.;;I'm not too big a man to admit that this game goes over my head and demands a willingness to play and experiment that does not come easy to me， as such i take more pleasure in watching it played than playing it.;;8.5/10 None the less;;Not all doors are wounds， but all wounds are doors,2022-11-07 23:38:15,2022-11-07 23:38:15,True,0,0,0,0,False,False,False,True,,525,False,,
76561198027084717,735,45,579,0,579,2022-11-07 17:02:09,125093264,english,Somewhat mixed feelings， but recommend overall. Probably best to get this on sale.,2022-11-07 17:14:59,2022-11-07 17:18:16,True,0,0,0,0,True,False,False,True,,82,True,,
76561198828021539,215,46,2018,0,1118,2022-12-29 01:12:46,125083886,schinese,10个小时的档眼看就要飞升胜利了。;不知哪蹦出来5个入迷给我秒了。;cnm。,2022-11-07 11:08:14,2022-11-07 11:08:14,True,0,0,0,0,True,False,False,True,,38,False,,
76561199093293870,76,5,2449,0,2449,2022-10-11 13:54:01,125083573,schinese,推荐：喜欢神秘学相关内容的玩家可以尝试。;性价比：比较差，建议等打折。虽然很少打折。;,2022-11-07 10:58:27,2022-11-07 10:58:27,True,0,0,0,0,True,False,False,True,,43,False,,
76561198921736220,17,1,2525,617,589,2023-04-30 15:21:22,125043554,schinese,完全没看攻略直接上手，慢慢摸索的过程也很有意思，卡牌运行的时间安排的挺好，新人需要时间思考如何组合生成新卡。,2022-11-06 19:56:53,2022-11-06 19:56:53,True,0,0,0,0,True,False,False,True,,54,False,,
76561199238616096,33,1,2919,0,2919,2022-11-04 21:37:02,125035618,schinese,享受。不仅需要996007呕心沥血养教徒废寝忘食学语言翻书，还会有五个人和无数个复制人在后面追杀你。别人问我这游戏好玩吗我不好说。但我觉得所有人都应该享受这种生不如死的痛苦。;,2022-11-06 16:35:52,2022-11-06 16:35:52,True,0,0,0,0,False,False,False,True,,88,False,,
76561198413603445,60,9,48,0,48,2022-11-06 14:37:28,125031956,schinese,新手教程根本没有，一头雾水玩得头昏脑胀，死都不知道怎么死的，玩个游戏还得查别的攻略，那做什么游戏,2022-11-06 14:44:57,2022-11-06 14:44:57,False,0,0,0.441988945007324219,0,False,False,False,True,,48,False,,
76561199384581937,1,1,861,0,826,2023-01-11 18:32:18,124973007,schinese,很好玩,2022-11-05 14:16:23,2022-11-05 14:16:23,True,0,0,0,0,True,False,False,True,,3,False,,
76561198951717141,368,11,5824,0,5709,2023-04-12 19:56:29,124963078,schinese,《密教模拟器》在我这里最出彩的甚至不是游戏机制本身，而是它出色的文本，无论是原文还是译文。;;鉴于Alexis Kennedy是Stellaris时之J事件链的外包作者，文本本身的高质量不足为奇。而中文译者显然是花了很大功夫去精心雕琢，不仅做到了锦上添花，使其更具神秘学色彩，还增强了独特的艺术性，以至于在该游戏的贴吧内都流行起了模拟密教文风的浪潮。我常常在阅读文本时惊叹于他们的巧思。;;每个密传对应的文风各不相同，譬如「冬」最具静默淡泊的美感，而「启」显然是仿照了圣经的风格。我个人最偏爱「蛾」的文本（本质蛾人XD），如晋升信徒时的――“时而剪子，时而小刀。时而为树，时而为骨。时而是月之振翅，时而是魂之生斑。他曾是血，而我们也将和他一样。”（'Now the scissors， and then the knife. Now the wood， and then the bones. Now the flutter of the moon， and then the dappling of the soul. He was blood， and so will we be.'）。以及有翼人偶的――“白骨屋上的阁楼有扇窗子。窗子旁边有个盒子。盒子里面有卷绷带。绷带里面有团乱发。乱发里面缠着只人偶，因为窗户从未打开过。”……这样一种极其微妙的混乱感，令人着迷。（入迷+1）;;回到游戏本身，一款非常适合强迫症的桌面整理模拟器。流程可长可短，取决于想苟多久。如果有耐心为了闪刃教会攒刃密传的话，那后期直接无敌，一刀一个警探杀穿防剿局，伦敦兄弟会了属于是。;;玩久了觉得流程有些重复，希望早出新dlc，顺便期待下日后的司辰之书。,2022-11-05 09:36:33,2022-11-05 09:36:33,True,39,1,0.793914377689361572,0,True,False,False,True,,718,False,,
76561198123899305,11,3,964,0,875,2022-11-21 06:09:01,124952654,english,I really wanted to like this game， it was hard to decide wether to give a thumbs up or down. In the end I have to choose based on the number of likes it has， just to balance it. ;In the beginning， the game is truly fascinating - the mystery， the writing， the cool unique gameplay， you are eager to find out what comes next and find yourself playing for hours， dying now and then. Well， once you figure out the card combinations and what you have to do， the game becomes extremely repetitive and frustrating. Once you place a card somewhere you shouldn't， you cannot cancel the timer and have it back. Once you fail (and there are tons of ways to fail)， you cannot go back to a previous "saved game"， you have to start from scratch， the entire process， all over again. I like the comparison with solitaire， except that here the game from start to finish is extremely long. One mistake， and all that work and progress goes down the drain， and you have to start all over again. Fun， right?;I didn't even start about the game interface and the "snap boxes" where the cards go in. To play this game well， you should organize your cards in a logical way， and that is part of the fun I guess， but that is impossible to keep up as the game just spits out new cards wherever it wants. At least half of the time you spend on pause just rearranging your cards， cause the game just spits them out all over the place. ;All in all， I would say its a very cool unique game that needs some tweaking. I 100% agree with what someone here said， it would be considerably less annoying if you could set up "auto" functions for repetitive tasks - e.g. the "work" box， and define where which card type goes (e.g. I would've loved it if the game placed the new card in the same spot where I last left that type of card). Easy access to previous saves would also be a much needed feature.,2022-11-05 05:14:52,2022-11-05 05:14:52,False,1,0,0.476190477609634399,0,True,False,False,True,,1864,False,,
76561199111130269,23,1,4043,0,1349,2023-03-29 23:39:32,124937332,schinese,非常棒的模拟经营游戏，文案水平也相当高，唯一一点不知道是特性还是bug的问题是开局后几乎马上就会出季节，导致我富家公子线迟迟不出入梦但已经出了张病痛险些没活过我爹，并且侍宴使徒线长生者还没来得及动手我就自己得病搞死自己了……因此我养成了开局什么都不干先猛研究健康的习惯,2022-11-04 23:20:34,2022-11-04 23:20:34,True,7,2,0.600967347621917725,0,False,False,False,True,,134,False,,
