steamid,num_games_owned,num_reviews,playtime_forever(min),playtime_last_two_weeks(min),playtime_at_review(min),last_played,recommendationid,language,review,timestamp_created,timestamp_updated,voted_up,votes_up,votes_funny,weighted_vote_score,comment_count,steam_purchase,received_for_free,written_during_early_access,hidden_in_steam_china,steam_china_location,review_length,review_updated,timestamp_dev_responded, developer_response
76561198206940093,107,10,518,0,503,2023-03-29 19:21:33,131654251,schinese,非常推荐这款游戏，之前一直玩盗版现在补上票了（甚至是让我第一次正儿八经写评价）;这个游戏没有新手教程，甚至看起来也没有什么剧情，但是玩家在追求通关目标――“飞升”时一次次的死亡，似乎对应着“我”在一重重历史中对于飞升的探索和追求。密教模拟器用一种巧妙的方式让玩家书写属于自己的故事，用优美的文笔让玩家沉浸在“密教”的世界中:steamthumbsup:,2023-01-27 22:03:24,2023-01-27 22:03:24,True,2,1,0.451612889766693115,0,False,False,False,True,,176,False,,
76561198066200826,267,8,298,0,298,2022-11-24 00:58:21,131619511,english,The gameplay seems fun at first. It actually starts fun but gets dull very quickly. Wouldn't recommend it for more than 5$,2023-01-27 07:29:58,2023-01-27 07:29:58,False,0,0,0,0,True,False,False,True,,122,False,,
76561198441573814,147,13,3149,28,1901,2023-04-21 08:09:59,131591688,schinese,能不能多个存档位啊，前期运营极其枯燥烦人，踩了个雷直接死了全部木大，别的rougelike不能存档就算了，你一个周期几个小时这样搞合理吗？从不确凿证据开始跑了四趟骑士小屋不出人情；平时疯狂来，拼命来，跟苏姐对话五六次保下来的人情，结果用不上，就这一次没找到人情直接给我拿下了，直接前功尽弃,2023-01-26 22:51:41,2023-01-26 22:51:41,True,0,0,0,0,True,False,False,True,,144,False,,
76561198173387295,64,25,492,0,492,2023-01-19 19:10:31,131578167,english,pretty fun actually if you have a 500 iq brain,2023-01-26 17:48:57,2023-01-26 17:48:57,True,2,2,0.53271031379699707,0,True,False,False,True,,46,False,,
76561199088000547,64,1,1370,0,1187,2023-01-27 19:08:31,131505762,schinese,相当上头，就是新手入门非常难,2023-01-25 13:36:41,2023-01-25 13:36:41,True,1,0,0.507042229175567627,0,True,False,False,True,,14,False,,
76561198345369402,127,2,17359,0,10342,2023-04-04 19:36:53,131471516,schinese,世界观神秘庞大，内容非常丰富，唯一的不好是新手指引比较少，由于内容很丰富会显得很不友好。另外开了控制台之后会导致拼搏的乐趣锐减，除非精通该游戏开始速通不然不建议开控制台,2023-01-25 00:38:29,2023-01-25 00:38:29,True,4,0,0.557894766330718994,0,True,False,False,True,,84,False,,
76561198065759998,245,1,933,0,401,2023-01-24 20:18:56,131407255,english,I acknowledge that the game advertises its lack of a tutorial as "part of the challenge" right on the store page， but the deliberately obtuse directions and total lack of clear objectives or indicators of progress are far too hostile to the beginning player. These issues， compounded with several others， collectively fail to create any incentive to explore many gameplay options or engage with the lore， which， to my understanding， almost universally receives high praise. Nearly every facet of this game is hurt by this.;;The gameplay cycle can really only be described as tedium; the initial phase of resource pooling at the start of a run does vary a little depending on the legacy you choose， but afterwards， every run proceeds the same for hours. The inconsistent durations of the action timers， as well as the intrusion of random actions， necessitate frequent pausing which really kills any sense of flow and can be particularly distracting when working towards larger goals. While it seems like this game does have an incredible depth to the mechanics and the choices necessary to acquire cards for the major win conditions， I find myself only making incremental discoveries with each subsequent run despite active attempts to try new things and only having played a handful of hours， which to me is a really bad omen of the time investment to come.;;The current user interface is very clunky. New cards tend to generate on top of other cards in the spawn frame， cards that should be stackable aren't， and the auto-stack option occasionally doesn't work. The lack of an automatic (or even user-defined) sorting system is criminal for a game like this， and attempting to relate card disorganisation to some narrative sense of chaos is kind of obnoxious. I cannot personally attribute praise to the overall narrative or the little flavour texts associated with each action and card as the time-sensitive gameplay cycle discourages paying attention to them， and I haven't quite developed a Stockholm syndrome brand of curiosity to actively seek them out. The art is pretty though， and the original soundtrack is quite good too， although the short tracklist doesn't help the sense of monotony.;;I'll probably still give it another chance or two， but I really cannot recommend this. It is frustrating to learn， and boring to play after that.;;Addendum: I think my previous assumption of a deeper lategame stage was a bit generous. While fulfilling the various win conditions does require fairly specific resources， the methods of obtaining them remain just as monotonous as the midgame. [spoiler]Farming Secret Histories via the Ways is a repetitive process， the Frangiclave tool is simply broken， lategame Vault Obstacles are no more difficult to overcome[/spoiler]， etc. Acquiring the final few cards for a specific ending boils down to repeating these actions over and over again， with the whole process being artificially drawn out by [spoiler]Hunters， Illnesses， and other random actions that no longer pose as threats.[/spoiler];;The gameplay remains consistently tedious from start to finish， and there isn't really a sense of accomplishment after successfully beating a run. The overall execution of the game's ideas is disappointing， and I cannot recommend.,2023-01-23 23:03:16,2023-01-24 21:00:33,False,46,4,0.732808232307434082,7,False,False,False,True,,3269,True,,
76561198893976094,99,4,2006,0,1916,2023-01-23 14:59:41,131348734,schinese,恋爱模拟器,2023-01-23 00:21:34,2023-01-23 00:21:34,True,0,0,0,0,True,False,False,True,,5,False,,
76561199368863785,55,6,1169,0,31,2023-02-15 19:00:38,131330910,schinese,为什么差评：;;1.游戏重复性极严重，没有任何一个有耐心的人应该在这种地方浪费他们的时间；;;2.缺失的新手教程：最适合新手的教程应该是Ctrl+~;;3.不负责的作者，以及完全无效的DLL模组：,2023-01-22 19:28:20,2023-02-13 16:29:39,False,1,0,0,0,True,False,False,True,,98,True,,
76561198450614937,39,1,1027,0,786,2023-01-23 00:45:59,131329908,schinese,真的牛批,2023-01-22 19:07:44,2023-01-22 19:07:44,True,0,0,0,0,True,False,False,True,,4,False,,
76561198097533896,87,9,1566,0,1556,2023-02-04 09:40:47,131322926,english,Challenging with emphasis put on experimentation and lateral thinking to defeat obstacles. Very atmospheric and story-rich， I love the world Cultist Simlulator is set in. Gameplay is interesting but quickly becomes tedious as your playthroughs enter midgame. I would consider it essential to use a mod that allows you to repeat tasks as it saves you ALOT of brainpower. If the devs decide to add this as a basegame behavior it instantly becomes 10/10 material.,2023-01-22 16:22:29,2023-01-22 16:22:29,True,0,0,0,0,True,False,False,True,,460,False,,
76561199084564914,73,13,249,0,249,2023-01-21 11:42:27,131309393,schinese,打工人模拟器,2023-01-22 10:25:16,2023-01-22 10:25:16,True,0,0,0,0,False,False,False,True,,6,False,,
76561197998277362,447,8,11889,0,8671,2023-02-01 09:57:43,131292737,english,I love this game， I really do. But， you shouldn't play it. There are many flaws in the design that encourage players to get caught up into tedious， repetitive loops -- that then punish the player for being in said loop.;;You won't get any proper alerts. You won't get any warnings. You have a huge board to manage and repetitive tasks that you must partake in or not advance. You are going to just place the wrong card or repeat your last action (that you've repeated literally a 100 times) without thinking and screw yourself on a solution to something irreversible.;;If you love pain and being punished by the game cycle， as a rule -- play this. It's 95% amazing but， the 5% (tedium， repetitive with no give， perma-punishments for simple mistakes and tight windows) really pisses me off.,2023-01-22 04:21:19,2023-01-22 04:21:19,False,7,0,0.599077403545379639,0,False,False,False,True,,791,False,,
76561199119583779,17,5,935,0,834,2023-02-25 10:49:04,131268906,schinese,为什么不早说有些教派需要买DLC,2023-01-21 21:18:21,2023-01-21 21:18:21,True,1,0,0.507042229175567627,0,True,False,False,True,,16,False,,
76561198059643100,88,17,935,0,452,2023-02-03 05:46:22,131231529,english,You opened the box， we came， take our pleasures. - cit.,2023-01-21 05:37:48,2023-01-21 05:37:48,True,0,0,0,0,False,False,False,True,,55,False,,
76561199375047525,38,15,646,0,606,2023-04-14 19:50:36,131211015,schinese,很难 但很上头,2023-01-20 22:59:15,2023-01-20 22:59:15,True,0,0,0,0,False,False,False,True,,7,False,,
76561199225711623,9,3,2577,0,2576,2023-01-30 21:35:21,131197602,schinese,优点：独特、美丽而神秘的迷人文本，以及其背后浩瀚的背景设定，玩法很吸引我――那种能让我“再玩一会儿、再玩一会儿”结果又一个小时过去了的吸引，个人当然是最喜欢食尸鬼DLC啦，非常、非常美丽，值得购买。;缺点：重复的刷东西流程，在多周目的情况下容易显得枯燥无味；缺乏足够的引导，若是不查询攻略，极难入门。;但总体而言，我很推荐花几十个小时，选自己喜欢的几条线飞升一下的。,2023-01-20 18:15:30,2023-01-20 18:15:30,True,0,0,0,0,True,False,False,True,,183,False,,
76561198068524421,101,40,1835,0,1835,2023-01-20 06:03:50,131192565,english,30 hours in， I think I finally understand this game， but I don't think I'm having much fun playing it. The writing and worldbuilding are great， but everything about the game itself undercuts them: you have to keep zooming and scrolling around to read tiny text; most of the gameplay is just dragging cards from one location to another (no helpful shortcuts like "repeat action"， almost no mechanical reason to pay attention to the story); you're either constantly mashing the pause button on double speed or sitting around bored on regular speed; the timer and the sheer repetitive grindiness encourages you to ignore the flavour text anyway. You can go from perfectly fine to game over in three minutes if you're not careful， and it's hard to stay careful when you're encouraged to just mindlessly continue the same actions. A really cool game could be made from this story， but this isn't it.,2023-01-20 15:55:19,2023-01-20 15:55:19,False,20,0,0.678792893886566162,0,True,False,False,True,,894,False,,
76561198050022347,81,4,3847,0,3040,2023-02-12 02:32:14,131152717,english,Oh， it's 5 AM again， and I have work tomorrow. AGAIN.,2023-01-19 23:52:47,2023-01-19 23:52:47,True,1,0,0,0,False,False,False,True,,53,False,,
76561198376208949,91,7,1048,0,1048,2022-10-12 15:51:24,131141921,schinese,冷门的优秀游戏,2023-01-19 20:09:29,2023-01-19 20:09:29,True,0,0,0,0,False,False,False,True,,7,False,,
76561199028972426,95,6,4279,0,4252,2023-04-11 21:22:26,131131485,schinese,我们拜请白日铸炉，愿k的热力能触碰我。,2023-01-19 15:21:03,2023-01-19 15:21:03,True,0,0,0,0,True,False,False,True,,19,False,,
76561199038655092,65,1,3802,0,2893,2023-02-11 00:29:36,131122636,schinese,冬促的时候入的，我给这个游戏的评价其实应该叫“中评”，但我沉迷了这个游戏较长时间还是给它好评，游戏的优缺点大伙都说得差不多了，我就说一件事，萌新（如果这个游戏还有)入这个游戏，一定先要去网上（如B站，贴吧）查攻略，这个游戏的新手教程和说明极少。谨记！;希望下一作《司辰之书》（《时之书》）有所改变。,2023-01-19 11:07:26,2023-01-19 11:07:26,True,1,0,0.517857193946838379,0,True,False,False,True,,149,False,,
76561198105961264,373,7,317,0,317,2023-01-19 05:58:12,131111282,english,Plate spinning game,2023-01-19 06:10:19,2023-01-19 06:10:19,False,6,0,0.585262119770050049,0,True,False,False,True,,19,False,,
76561198201666671,154,15,2699,0,2699,2022-12-07 22:42:23,131090698,schinese,很杀时间的游戏，很容易沉迷进去，对于新手难度有点大，建议同时查阅wiki游玩，虽然大多数时间容易卡在一个阶段，消耗大量无意义时间并且容易突然暴毙，但是这游戏强大的中文化团队让游戏上升到了一个新的高度,2023-01-18 22:53:31,2023-01-18 22:53:31,True,1,0,0,0,False,False,False,True,,99,False,,
76561198403844495,62,3,282,0,282,2023-01-17 18:07:04,131081963,schinese,游戏内容非常对味，有一种搞密教的魔怔的感觉，但我确实玩不明白,2023-01-18 19:34:04,2023-01-18 19:34:04,True,1,0,0.523809552192687988,0,False,False,False,True,,30,False,,
76561198373097404,91,18,1758,0,1758,2023-01-17 23:14:06,131035435,schinese,点得尼玛手痛，什么臭粪？程序员再回去学学,2023-01-17 23:19:44,2023-01-17 23:19:44,False,0,0,0.39682537317276001,1,True,False,False,True,,20,False,,
76561199237968552,9,1,240,0,188,2023-01-18 00:07:40,131035136,schinese,献祭成功,2023-01-17 23:13:31,2023-01-17 23:13:31,True,1,0,0.50628364086151123,0,True,False,False,True,,4,False,,
76561198132499968,112,2,17200,0,15641,2023-01-29 00:35:20,131033605,english,I love this game so much; it is not fun，,2023-01-17 22:42:50,2023-01-17 22:42:50,True,43,14,0.816727399826049805,0,True,False,False,True,,40,False,,
76561199341678907,24,3,5799,0,2773,2023-03-01 15:26:16,131030289,english,if you dont go to the wiki， itll drain youre soul， if you go to the wiki， youll get bored,2023-01-17 21:34:51,2023-01-17 21:34:51,True,66,4,0.82324981689453125,0,True,False,False,True,,89,False,,
76561197970313373,352,1,552,0,542,2023-03-08 03:10:06,131020772,english,Game seems cool， I'm not too far into it yet.;;Although， in my last session， after I finally managed to send people on an expedition it seems to have gotten stuck there? Or are expeditions REALLY long? (edit: Maybe they are really that long?);;Just be careful what you click on before buying. Because instead of getting the bundle with all the DLC， I got the one with "The Lady Afterwards" (I thought "The Lady Afterwards" was like some sort of special edition that included all the DLC or something)， which isn't even a video game， and I have no use for it.;;In my defense， "The Lady Afterwards" Steam page has minimum computer requirements and is marked as DLC， so it's not completely crazy that someone assumes it's a video game， instead of a separate pen and paper rule book.;;But because I played the main game for more than 2 hours (since I was enjoying it)， Steam is refusing to do anything about the mistaken purchase (I was asking them to change the bundle， but I guess there is no possibility for that， and I'm well over the 2 hour window for refunds).;;EDIT: I had initially left a bad review， but I'm changing it. The game seems good and my issue is mostly with Steam. Yes I think how the bundle is presented is a little bit misleading (mostly because it being a pen and paper thing is a bit unexpected)， but I feel like I should be able to tell Steam "In my 20 years of being a Steam customer， I clicked the wrong thing once， can we change the bundle?" and Steam would sort this out.,2023-01-17 17:28:07,2023-01-17 22:13:22,True,0,0,0,0,True,False,False,True,,1496,True,2023-01-17 19:04:58,Wotcha，;;Expeditions _are_ long， and occasionally people don't realise that they keep going until they succeed or run out of cash - I got a ticket to this effect earlier this month. If you start playing again， do please send me the save.json at support@weatherfactory.biz so I can check if something's actually broken or tell you if it's not.;;I get your annoyance about the TLA DLC... this is the first time I've seen this complaint but it probably won't be the last， because we are doing something unconventional， so I'll take a look at the copy and see if I can make it clearer. Also we can't process Steam refunds ourselves， but if you drop us a line at support@ no promises but I'll see if it's possible to offer you a merch voucher or something?;;cheers，;;AK
76561198209282811,80,4,447,0,439,2023-01-17 04:08:27,130990018,english,My lovers always try to kill me,2023-01-17 04:00:17,2023-01-17 04:00:17,True,0,0,0,0,True,False,False,True,,31,False,,
76561198068318385,364,53,41,0,41,2021-07-03 15:41:44,130960347,schinese,这东西跟无光之海一个德行。;世界观设定、氛围构建牛逼的不行，但【没有画面诠释】。所有的一切都在语焉不详、诗意朦胧的文字里进行，以猝不及防、毫无逻辑的收场结束。;玩法缺失引导，玩法缺失乐趣，玩法和游戏所想构建的世界几乎屁的关系也没有（无光之海在这一点上还好，但密教的玩法是真的烂，烂，烂！）;;附上在无光之海评测里的建议：你们可以出一本《哈扎尔辞典》来装逼嘛，何必要做游戏来折磨我们这些玩家。,2023-01-16 17:26:31,2023-01-16 17:26:31,False,3,1,0.4553813636302948,0,True,False,False,True,,195,False,,
76561198235865090,135,23,792,0,792,2023-01-11 14:54:13,130929189,schinese,惊艳的氛围塑造与叙事，充满诚意的文本（汉化也很棒），玩法也称得上非常有趣。卡牌描述非常有感觉，光是游戏内文本都值得反复品味，也很有重复游玩的价值。;不足之处在于新手指引较为隐蔽，且许多坑需要玩家先踩一遍；在叙事上也需要玩家对神秘学相关背景有一些基础的了解。同时，单局游戏时长比较长，而存读档又比较影响沉浸感，对于教主的肝是个考验;总体而言，如果玩家对于神秘学有一定兴趣，这个游戏不可错过。;;好,2023-01-16 04:26:59,2023-01-16 04:26:59,True,2,0,0,0,True,False,False,True,,197,False,,
76561198274845880,48,2,4948,0,4844,2023-01-22 11:50:54,130921754,english,The joy of discovery,2023-01-16 02:19:07,2023-01-16 02:19:07,True,0,0,0,0,True,False,False,True,,20,False,,
76561198154069188,2,1,3110,0,1995,2023-02-16 23:10:26,130911066,english,I'm so obsessed with this game and the lore and everything about it. The game play is compelling and sucks me in， and the lore is so well written and fun to piece together. I really recommend this game.,2023-01-15 23:36:53,2023-01-15 23:36:53,True,1,0,0,0,True,False,False,True,,202,False,,
76561198982535997,83,5,1596,0,1474,2023-01-17 16:02:09,130889560,schinese,是款好游戏，但是很挑人;对晦涩的神秘学不感兴趣的，对解读谜语人剧情不感兴趣的以及没有耐心（读文本）的慎入;喜欢欣赏考究典雅文字的，喜欢挖掘文本下剧情与世界观的以及对神秘学感兴趣的非常推荐！,2023-01-15 17:18:40,2023-01-15 17:18:40,True,1,0,0.506769835948944092,0,True,False,False,True,,94,False,,
76561197989957223,352,2,3386,0,3356,2023-01-16 03:17:28,130871858,english,Very deep,2023-01-15 10:21:32,2023-01-15 10:21:32,True,0,0,0,0,True,False,False,True,,9,False,,
76561198407787392,78,28,633,0,243,2023-02-03 02:38:23,130855643,schinese,挺好玩的，但是个人认为上手成本较高。;没有新手引导，一上来面对卡牌不太明白这些卡牌都是什么用处或什么意思，不太清楚要怎么推进，遇到绝望无助的时节等不太清楚要如何迅速解决，想要上来就玩得明白可能得去查wiki，搜索几乎篇篇都是w+字的新手指引之类的......;但是好玩。;;,2023-01-15 04:52:20,2023-02-18 20:29:37,True,0,0,0,0,True,False,False,True,,137,True,,
76561198142402810,112,8,406,0,406,2023-01-14 22:37:17,130832914,schinese,我是教主×;我是打工人√,2023-01-14 22:45:56,2023-01-14 22:45:56,False,0,0,0,0,True,False,False,True,,12,False,,
76561198985656938,69,4,772,0,772,2022-12-26 22:21:42,130827618,schinese,好玩，像梦一样，不过有些繁琐,2023-01-14 21:15:15,2023-01-14 21:15:15,True,0,0,0,0,True,False,False,True,,14,False,,
76561199256680081,22,1,1834,0,1682,2023-03-09 00:38:23,130697734,schinese,，，，，,2023-01-12 21:17:19,2023-01-12 21:17:19,True,0,0,0,0,True,False,False,True,,4,False,,
76561198302619511,89,6,2100,0,2100,2022-12-07 00:00:25,130694265,schinese,只能说头像框把这个头像提升到了新的高度,2023-01-12 20:01:03,2023-01-12 20:01:03,True,0,0,0,0,True,False,False,True,,19,False,,
76561198452303204,67,17,2814,0,2124,2023-04-01 12:57:02,130693666,schinese,好玩，好玩的过头了。;我万万没想到在一个克系的世界里也得为了生活做一个卑微的牛马社畜。;不过幸好是在克系世界，刀子，疯子，婊子，对付上司的方法真多捏~,2023-01-12 19:47:02,2023-01-12 19:47:02,True,1,0,0,0,True,False,False,True,,75,False,,
76561198139477624,182,12,2486,0,2483,2023-01-12 01:28:27,130648672,schinese,岂有最苦，苦海无度,2023-01-12 01:26:44,2023-01-12 01:26:44,True,2,0,0.504950463771820068,0,True,False,False,True,,9,False,,
76561198857296854,58,4,5006,0,2335,2023-02-06 19:25:51,130635448,schinese,没看攻略自己摸索完成了一次杯飞，结果告诉我是小飞升？！变了身份之后还是重复开局繁琐的操作还有人一直捣乱.......渐渐失去耐心；不过游戏还是好游戏，建议等打折再入手。,2023-01-11 21:29:57,2023-01-11 21:29:57,True,0,0,0,0,True,False,False,True,,84,False,,
76561199079013444,38,11,7439,208,1969,2023-05-01 22:06:02,130628387,schinese,辉光已近在咫尺。它从居屋的质料渗入，为其添光。我看到守夜人的光芒在远方一片蓝色中闪耀，像是潜在海面下的太阳。,2023-01-11 18:56:51,2023-01-11 18:56:51,True,3,0,0.549549520015716553,0,True,False,False,True,,54,False,,
76561198358551495,103,28,1504,0,520,2023-01-22 10:34:46,130609412,english,THE LIGHT LEAKS THROUGH THE CRACKS;I SEE BEYOND THE VEIL;MY MIND SHINES EVER BRIGHTER,2023-01-11 10:44:04,2023-01-11 10:44:04,True,15,2,0.650095820426940918,0,True,False,False,True,,85,False,,
76561198157530790,53,5,1168,0,717,2023-01-15 17:40:51,130570332,schinese,缺点：游戏前期和后期都称得上坐牢，前期没教程，后期重复度高。前期不知道恐惧入迷邪名咋消，很容易死。后期即使是DLC内容（除流亡者）也只是飞升部分方式不同，整体的培养和玩法基本上一致，都是：堆三维，找教徒，买书读书，入梦刷东西，探险。;其次是游戏中的随机性部分，游戏中大部分内容都做不到百分之百成功。我估计制作组是故意的，但是一方面如果考虑到极端脸黑一直失败真的很搞心态。出过很多次消证据连续失败3、4次然后邪名越堆越多。另一方面考虑后期探索，基本上都要过3道关，每道关即使数值堆满了成功率也是90%，算下来就是有大于25%的概率你可能会失败。这些关卡失败了的惩罚如果是消耗探索的金币重新再过一次还好，但是大部分都会受伤，要你赶紧治人或者加另外一个人去探险，还有一部分会给你诅咒，诅咒你不知道怎么整的话就只能白白被吃掉三维，就算知道该怎么整也相当麻烦。总而言之这个随机性部分没有给我留下多少惊喜，只有血压。;最后一些碎碎念：工作部分要一直点，重复性劳动。密传的升级太慢了，过一大堆无用的30s通悟部分，我觉得要么就拉长升级放素材的部分可以不那么容易就错过（经常去管别的东西就忘了这个升级然后又要浪费半天去重新过那一大堆30s的部分），要么就缩短那些没什么意义的部分。;最后说一些优点：游戏的文本部分太强了，同时整体成功塑造了一个密教探寻飞升之路的氛围。游戏的世界观也挺厉害的（虽然只看文本的话很难全部连在一起），BGM和美术也没拉跨，玩法在学会了怎么不玩死之后也有大概二三十小时的游戏体验不错的时期。,2023-01-10 21:45:57,2023-01-10 21:51:51,False,50,1,0.799098551273345947,0,False,False,False,True,,651,True,,
76561199257228880,64,50,1670,0,1388,2023-01-12 12:42:46,130569264,schinese,没做好心理准备不要打开，不要打开，不要打开！;真玩不明白，完全没有新手指引，所有的东西都需要自己摸索，偏偏这个世界观又非常庞大，各种卡牌排列组合，规则多且繁杂，剧情全是碎片，看得人一头雾水。;不能说它不好玩，但真的很累人！游戏里的我（赵四）狂热追寻未知的伟大存在，游戏外我又累又暴躁两眼一抹黑，那种神神叨叨的状态是相通的，赵四（本教主名讳外人不可直呼）飞升了，我发癫了，我们都有美好的未来。,2023-01-10 21:26:32,2023-01-10 21:26:32,True,25,7,0.763137459754943848,0,True,False,False,True,,195,False,,
76561199205598804,50,3,2499,0,2499,2023-01-09 17:53:13,130563399,schinese,真的嘎嘎不错，世界感觉能写好几本书了，游模式也很新颖,2023-01-10 19:23:52,2023-01-10 19:23:52,True,0,0,0,0,True,False,False,True,,26,False,,
