steamid,num_games_owned,num_reviews,playtime_forever(min),playtime_last_two_weeks(min),playtime_at_review(min),last_played,recommendationid,language,review,timestamp_created,timestamp_updated,voted_up,votes_up,votes_funny,weighted_vote_score,comment_count,steam_purchase,received_for_free,written_during_early_access,hidden_in_steam_china,steam_china_location,review_length,review_updated,timestamp_dev_responded, developer_response
76561198005574741,2298,68,319,0,319,2022-08-10 19:42:13,120387327,english,I felt this game was an endless pointless loop， in which you can easily get stuck without being able to progress forward. ;;You constantly fall into endless loop grinds were you either have to die and restart or grind incredibly slowly with little change. I just wish the game would pull the plug. as you don't know if you are playing it correctly.;;There isn't many instructions on how to play or tactics， for a new player. Its not very clear for  a new player to understand what objectives you need to aim for. Or what cards turn into what. I felt every single time I was mashing buttons hoping something would highlight， even once I slowed down and read every prompt， I still didn't really have a goal as a player.;It just seems to be one of those games I played it for 5 hours getting better slightly each time， surviving longer. But with little progression. I felt like I only progressed 10% of what the game actually is. It just became such a grind I just couldn't take it anymore. I guess I just really sucked at this game. ;;It reminds me of minecraft， where you have to rely on external wiki's to understand what is going on but even so after watching a few videos it just felt like a grind. and really took the fun out of what you first experience with this game. After 5 hours I really felt I wasn't achieving anything. Its too much random attributes without a clear goal. If you really like learning obscure rules， this is the game for you. However if this is something you can throw some time into it and eventually finish. its to confusing， you spend more time trying to understand how to balance everything then aiming for the objective. too much going on at once， will overwhelm any causal player. ;;Game also crashed about 4-5 times in the four-ish hours for no reason. Unity just froze up and bottomed out， even more annoying when you are on a good run. ;;I got to the point， that my conclusion was this was lazy game design. As reading the store front， they promote how the game doesn't need a tutorial. So stupid， you just alienated an entire user base. after the 5 hours I really felt like I wasted my time. A tutorial should exist， does not have to reveal everything， but just enough to get you started. Or to lend a helping hand when you are visibly stuck ;;I don't recommend， unless you spend some time watching other people teach you the game online.  Otherwise its a grind and soon as you realise there is no way of telling you， you are doing something right. you have no clue if you are progressing correctly.,2022-08-10 20:02:49,2022-08-11 19:51:42,False,2,0,0,0,False,False,False,False,,2537,True,,
76561198351101417,36,5,2092,0,1617,2022-08-11 07:01:46,120382368,english,i still dont know how to do stuff but its still fun,2022-08-10 17:42:49,2022-08-10 17:42:49,True,0,0,0,0,True,False,False,False,,51,False,,
76561198035867367,49,2,2906,0,1992,2022-12-15 04:43:43,120371332,english,Great game. When you get deep into the lore and the mysteries， you start to see basic game elements like money， food， and friends as just distractions or annoyances blocking your way to greater understanding and power--just like your character in the game! A wonderful bit of ludonarrative assonance built-in to a fun puzzler. It has its flaws but the sparks of genius more than make up for them.,2022-08-10 11:51:52,2022-08-10 11:51:52,True,2,0,0.544726312160491943,0,True,False,False,False,,396,False,,
76561198179782917,243,14,854,0,704,2022-08-10 11:44:16,120353375,english,im confused,2022-08-10 04:00:35,2022-08-10 04:00:35,True,0,0,0.481481492519378662,0,False,False,False,False,,11,False,,
76561198366166507,202,15,5003,0,318,2022-08-21 21:37:03,120351798,english,Fascinating.,2022-08-10 03:27:18,2022-08-10 03:27:18,True,0,0,0,0,False,False,False,False,,12,False,,
76561198393996635,48,3,37,0,37,2022-08-09 21:15:24,120332737,tchinese,@[虻降自谛n三小?,2022-08-09 21:16:30,2022-08-09 21:16:30,False,0,0,0,0,False,False,False,False,,10,False,,
76561198126102842,88,17,6393,0,1283,2022-09-22 18:29:11,120324132,schinese,先说缺点，没有新手指引，啥都不知道的玩家很容易开局劝退。;能克服这点的话（指边玩游戏边查wiki看攻略），密教模拟器实在是不容错过的好游戏。AK的想象力令人惊叹，其塑造的世界完善且与精彩，充斥着神秘学的魅力。同时也要感谢汉化组为我们带来精致的翻译，文本完美营造了神秘学的氛围。;密教模拟器的精彩是毋庸置疑的，也无怪乎很多网文作者受其启发。;文字爱好者必入。,2022-08-09 17:56:01,2022-08-09 18:05:32,True,19,0,0.718423008918762207,0,True,False,False,False,,178,True,,
76561199142201152,10,1,3099,0,1919,2023-03-19 17:13:39,120316223,schinese,不得不说，密教是真的难玩，但也是真的好玩，没有新手教程看来好几个全流程视频还看了好几遍对照着wiki玩了三十多个小时才灯飞升（落泪了），强烈安利的说！！！,2022-08-09 14:00:45,2022-08-09 14:00:45,True,0,0,0,0,True,False,False,False,,77,False,,
76561199028041167,88,14,1354,0,243,2022-12-20 22:47:13,120315463,tchinese,我是傻逼;我是傻逼;我是傻逼,2022-08-09 13:35:03,2022-08-09 13:35:03,True,0,0,0,0,True,False,False,False,,14,False,,
76561198028663787,119,18,642,0,642,2022-08-08 15:53:06,120307856,english,i'm too stupid for this,2022-08-09 09:45:43,2022-08-09 09:45:43,True,0,0,0.481481492519378662,0,True,False,False,False,,23,False,,
76561198043268673,494,209,70,0,70,2022-08-09 02:05:51,120290213,english,If you read game texts， enjoy flavor text and go lore diving you might like this. The lore and presentation intrigued me.;;If you're looking for gameplay - this is a treadmill， that consists of 2 gameplay elements: Crafting and Survival.;;It will take a minute until you notice the crafting aspect (due to the game being cryptic)， but there are pretty clear outcomes to every action you take. There's a little bit of randomness here and there， but at the core， you could probably a simplistic script to win this game.;;Survival aspect is just you losing resources passively (some over time， some randomly) and sometimes running into resource checks. You lose if you run empty， on core resources or accumulate too many "bad" cards. Survival element very rarely adds something to a game. In this case it fits thematically， but it's still just game time padding. Look past that padding and you'll see how shallow the core (crafting) side is.,2022-08-09 02:22:48,2022-08-09 02:22:48,False,2,0,0.52173912525177002,0,False,False,False,False,,938,False,,
76561198162137320,252,23,14,0,14,2022-08-08 21:32:02,120277017,schinese,不是你们做游戏真的不做教程的？,2022-08-08 21:32:25,2022-08-08 21:32:25,False,2,0,0.483636379241943359,0,True,False,False,False,,15,False,,
76561197997282916,70,10,5282,3,1536,2023-04-24 18:15:19,120267662,schinese,看评论：哦，社畜模拟器啊;看攻略：从超凡蜕变到仪式飞升;自己玩：我是谁？我在干啥？,2022-08-08 17:23:40,2022-08-08 17:23:40,True,1,0,0.513513505458831787,0,True,False,False,False,,41,False,,
76561197963260222,1787,106,365,0,365,2022-08-08 05:23:11,120243637,english,Neat idea and fairly unique in terms of execution， but has a lot of problems. The game is a mashup of a lot of elements but it boils down to a semi-worker placement card game revolving around a lot of trial-and-error and hoping to get lucky with the correct combination of things appearing. This idea works in "Stacklands" because it is quicker， more focused， and not as punishing.;;However， here it is very painful as the "try different combinations to get things to work" takes time， effort， energy， and more all while other things are ticking on in the background. It is very easy to spiral out of control with not having money or enough resources to solve problems that pop up. Not a deal breaker itself， but there are 2 key issues that result in it being a mess.;;First， there are no save slots -- it is a rogue-like where you will be spending hours building up and "rolling the dice" on finding things that can all end abruptly if you mess up or get unlucky. With multiple save slots you could actually experiment and figure stuff out without dooming a multiple hour game from a single tiny mistake.;;And second -- the game often boils down to rolling for specific items over and over hoping to get the correct type of magic to progress. There are 9-ish paths of magic and getting pieces of them is largely random. You meander around collecting fragments of lore to complete a mission and only 1/9th of them are applicable (yes some build / help get others but how would you know without more trial-and-error?). That means you're juggling dozens of things just to hope you roll the dice on finding the right combination you're looking for.;;Even using a Wiki to look up the stuff is difficult because there is just so much thrown together in convoluted ways. This game might have been a borderline recommend if they simple had save states and the ability to undo things... but make some mistakes and you're back to 3+ hours of grinding to get back to where you were all because you did the wrong thing without knowing any better. Ugh.;;Cool idea， neat theme， and fun mechanisms... but the whole execution is a slog. 4/10. Just pick up "Stacklands" instead.,2022-08-08 05:33:51,2022-08-08 06:07:12,False,4,0,0.550408720970153809,0,False,False,False,False,,2162,True,,
76561198147781323,1310,34,796,0,796,2021-09-07 19:23:34,120226213,schinese,恶性bug能不能修复一下 无语了,2022-08-07 23:39:15,2022-08-07 23:39:15,False,1,0,0.523809552192687988,0,False,False,False,False,,16,False,,
76561198098816427,134,22,5062,0,1174,2022-12-13 17:48:29,120220844,schinese,大概玩了10个小时左右才知道自己在干什么，有趣 停不下来,2022-08-07 21:52:55,2022-08-07 21:52:55,True,0,0,0,0,False,False,False,False,,28,False,,
76561198109365650,160,8,2090,0,1036,2023-01-11 21:35:16,120210537,schinese,是个好游戏，但引导为零.......这17个小时我真的不知道自己在干嘛！！！,2022-08-07 17:52:21,2022-08-07 17:52:21,False,1,0,0.52173912525177002,0,True,False,False,False,,38,False,,
76561198359829231,183,56,735,0,735,2022-08-07 12:41:08,120204181,schinese,+玩法和题材都很上头;+玩法层次感比较强，一个周目里面不太会玩腻;-引导非常差，不看攻略基本没法玩;-二周目基本没有吸引力;-后期比较卡而且卡牌乱飞,2022-08-07 14:54:33,2022-08-07 14:54:33,True,0,0,0,0,False,False,False,False,,74,False,,
76561198076819315,207,12,552,0,552,2022-07-29 16:53:13,120196607,english,Grindy， RNG-based， and unsatisfying. The actual content is really interesting， which is why it's so frustrating that the gameplay itself slows to an agonizing crawl by the end. I know exactly what I need to do to win， it's just a matter of waiting and waiting and waiting for the game to give me what I know I need.;;Get it on steep discount. 8$ or less.,2022-08-07 11:04:55,2022-08-07 11:04:55,False,20,0,0.623372018337249756,0,False,False,False,False,,354,False,,
76561197997816482,216,72,201,0,201,2022-08-07 02:24:49,120196175,english,First 30 minutes are interesting， but as soon as you figure out basic mechanics it seems to become a big grind - one that is made worse by the fact that you have no idea what you're grinding for， or how much grinding is left until you see some sort of progress. Also， having to constantly micromanage the layout of cards is a huge pain.,2022-08-07 10:52:23,2022-08-07 10:52:23,False,8,0,0.548170328140258789,0,False,False,False,False,,336,False,,
76561198062407872,308,12,123,0,123,2022-08-07 01:28:10,120174082,english,Terrible UI. Annoying to use and learn. Was trying to give this game a fair shot in my last run， but it crashed in the middle of it. Not worth giving it more of my time. Don't bother with this mess.,2022-08-07 01:30:45,2022-08-07 01:30:45,False,4,0,0.529243946075439453,0,False,False,False,False,,198,False,,
76561198004227357,416,20,1678,0,1678,2022-08-06 15:57:53,120172566,english,Cultist Simulator is a game filled with unrealized potential. ;;A typical playthrough takes 20+ hours， but only ~5 hours of your first game will be exploring and figuring out how stuff works. Once you've done that， the game degenerates just route 'going through the motions' as you farm up enough resources to achieve your goals.;;One example is exploration. If you want to explore 1 location in the Evening Isles， you need to farm up 16 Chronicles， and each Chronicle has a 33% chance of dropping from an activity that takes 1 minute to complete... so on average， you'll be doing that exact same activity 48 times per exploration， and you might need to do that exploration 5 times to collect an item you need to win the game， so now you're doing that activity 240 times. That's 3 hours of nothing but grinding chronicles. Absurd. ;;Secondly， the game supposedly has a pretty big focus on lore and mystique， and it does... but only on the surface. You soon learn that the game's lore has very little to do with the actual mechanics， and it doesn't matter if you know who The Colonel is or what The Door in the Eye and the Forge of Days are， or why you would want to invoke any of them. The only thing that matters is that this obstacle needs 10 'lantern' to defeat it， and 'lantern' is basically just 'yellow mana' in the vein of MTG. You never need to (and， in fact， cannot) ever use any of the lore you uncover for solving puzzles or making deductions. It's all irrelevant narrative fluff.;;Finally， Cultist Simulator doesn't actually simulate running a cult. Every cultist you can recruit is identical except for their 'mana' type. They have no personality， desires， or weaknesses. Recruiting them is as simple as saying "join my cult， we have a shiny object" and them going "sounds legit， okay!" at which point they immediately become your willing slave， following any order you give them up to and including killing themselves. It would be a lot more compelling if you actually had to persuade， seduce， or brainwash them into compliance instead of just showing them a cool object you found.,2022-08-07 00:53:08,2022-08-07 06:58:48,False,32,0,0.700380206108093262,0,False,False,False,False,,2096,True,,
76561198109905494,44,2,515,0,471,2022-08-09 09:04:08,120160575,english,Fun game;My computer died while playing the game and then I couldn't play for a while. The game would not load on fresh install. Support was eventually helpful but had issues receiving the game files so their help was limited. The gameplay was alright but the game being quite literally unplayable for a time means I cautiously recommend.;Maybe only get it on sale,2022-08-06 20:37:43,2022-08-09 08:57:34,True,0,0,0,0,True,False,False,False,,364,True,,
76561198120773498,241,10,1092,0,358,2022-08-13 08:24:26,120143607,english,It starts off seeming a little simple and maybe hard to understand， but the further you descend into the game， the more you realize there's a ton to discover about it. Very very cool.;;One complaint - not sure why I have to physically wait for the timer to pass. I pretty much always want to pause as soon as one timer completes and see what happened， make my next moves if I need to， and then repeat the cycle. It could have just been built to do that automatically - the timers are usually pretty quick though.,2022-08-06 12:25:56,2022-08-06 12:25:56,True,1,0,0.507462680339813232,0,True,False,False,False,,512,False,,
76561198094001843,93,8,7875,0,7391,2023-02-26 18:16:00,120142712,english,Beautifully written， and based on a fascinating mythology that reveals itself slowly over every playthough. Also crushingly difficult. I wouldn't have it any other way \_(ツ)_/,2022-08-06 11:59:47,2022-08-06 11:59:47,True,0,0,0,0,True,False,False,False,,177,False,,
76561198040191697,124,6,671,0,567,2022-10-18 01:06:38,120140711,english,I have a lot more than 9 hours. Amazing game， by far one of the most original ideas in gaming history. AAA games should take a bow to this masterpiece.,2022-08-06 11:01:08,2022-08-06 11:01:08,True,0,0,0.476190477609634399,0,True,False,False,False,,151,False,,
76561199072518017,38,1,1139,0,286,2022-10-21 00:52:33,120099254,schinese,好！,2022-08-05 18:30:30,2022-08-05 18:30:30,True,0,0,0,0,True,False,False,False,,2,False,,
76561198007182373,467,23,3906,0,3906,2022-08-05 05:37:43,120072624,english,A game about mysteries， with incredible writing.;;The biggest drag is that when you begin a game， you must build yourself up from nothing， and both death and victory means re-doing this slow build until you have the traits， funds， and various other supplies and secrets to make the later-game activities possible， but personally I don't consider that a negative--I enjoy the grind.,2022-08-05 05:39:24,2022-08-05 05:39:24,True,0,0,0,0,True,False,False,False,,381,False,,
76561198124744948,96,5,3827,0,2862,2022-08-21 17:01:52,120049515,english,Cultist Simulator is a story-rich， tabletop roguelike where you choose your path. I love this game. It can get a bit repetitive but there is enough content to keep you entertained for hours on end! The major victories feel so rewarding and just seeing the 0.x% of players achievements pop up feel like a completed challenge.;;Would highly recommend!!,2022-08-04 21:28:46,2022-08-04 21:28:46,True,0,0,0,0,True,False,False,False,,351,False,,
76561198821094667,37,2,10950,0,8276,2023-01-08 13:54:56,120017863,schinese,司辰很可爱，敏感肌也能用，希望在成为杯具名者后伊泽姆挑逗铸炉时能带我一个，70买一次和铸炉的贴贴我心满意足。,2022-08-04 06:30:46,2022-08-04 06:30:46,True,16,15,0.678070008754730225,0,True,False,False,False,,54,False,,
76561198110895010,265,3,976,0,976,2022-08-04 08:12:00,120011552,english,I have no idea what I'm doing;;;9/10,2022-08-04 04:09:11,2022-08-04 04:09:11,True,0,0,0,0,False,False,False,False,,36,False,,
76561198131215047,125,5,1678,0,461,2023-01-20 06:50:09,120006052,english,10/10,2022-08-04 02:13:10,2022-08-04 02:13:10,True,0,0,0,0,True,False,False,False,,9,False,,
76561198801064925,770,12,1645,0,827,2022-11-18 09:39:04,119998597,schinese,密教模拟器本身绝对是好游戏，在玩儿的过程中，你会发现一切十分现实的细节，让人直呼雾草。;最大的缺点就是引导做的稀烂！;要么慢慢自己瞎摸索，要么查攻略，还贼杀时间！;不建议好不容易才得闲的人和耐心稍弱的人游玩儿。;;,2022-08-03 23:30:46,2022-08-03 23:30:46,True,1,0,0.509803950786590576,0,False,False,False,False,,107,False,,
76561198100886481,284,4,1443,0,284,2022-08-09 00:45:28,119997273,english,OLD "The game is really fun. My only issue is that I can't even make through a full run (which i doubt is as long as it could be because I suck) without it crashing. Sometimes you go back quite a bit which isn't great. When the game is working， though， it's great.";;I mean， it's working better for me now. And as I said， when it's working， great game.,2022-08-03 23:01:15,2022-08-09 21:15:22,True,0,0,0.523809552192687988,0,False,False,False,False,,352,True,,
76561199350864209,51,3,825,0,82,2023-03-10 14:14:06,119987726,english,nice,2022-08-03 19:17:43,2022-08-03 19:17:43,True,0,0,0,0,True,False,False,False,,4,False,,
76561198070243751,323,6,2983,0,1963,2023-04-01 01:01:03,119966704,english,summon a demon to teach u latin,2022-08-03 08:38:06,2022-08-03 08:38:06,True,0,0,0,0,False,False,False,False,,31,False,,
76561198118896004,116,7,4053,0,2993,2022-08-11 23:57:35,119957126,schinese,・如果代码运行起来没问题，那就别碰它;・试图挖屎山的结果就是被屎淹没;;入坑也算比较早，前几个版本挺好的，最近更新的版本可以说优化鬼才，nmd，就这么点固定内容的玩意也不知道有什么好更新的，不是增加游戏内容，而是纯粹重做无关紧要UI，结果还做出一堆BUG的也是着实少见。飞鸟/蠕虫的设置给删了，萌新再也不能拖拽保命了，改了部分框架和机制的结果就是BUG频出。卡牌消失，文本重叠，入梦卡死，槽位框卡牌卡死……;;萌新入坑推荐找一找老版本的学习版。游戏本身小众，没啥可玩性，但对上口味也还不错。就是这几个版本搞的乱七八糟的BUG让人着实头疼，真・正版受害者，不如三大妈。啥时候BUG修差不多了啥时候改回来,2022-08-03 04:34:04,2022-08-03 04:36:09,False,7,0,0.577447891235351563,0,True,False,False,False,,300,True,,
76561198398683505,95,3,254,0,235,2022-08-15 04:39:37,119955642,english,I have no idea what I'm doing and I can't stop playing.;;Like how does it work? I don't know， I move things and things happen or don't happen and more things happen then I lose and it starts over again.;;I'm very confused and I love it,2022-08-03 04:02:44,2022-08-03 04:02:44,True,0,0,0,0,False,False,False,False,,235,False,,
76561199332571248,13,1,2220,0,1625,2022-12-22 16:05:00,119921316,schinese,设定很有趣，但是太难上手了,2022-08-02 13:29:22,2022-08-02 13:29:22,True,0,0,0,0,True,False,False,False,,13,False,,
76561197978436896,780,8,2380,0,2380,2022-05-09 16:39:44,119913671,english,This game hits all the right notes with game design.;;As others have commented there is the repetition of needing to repeat your day job over and over again. But that seems like it's the flavorful intent of the game designer.;Doing the boring 9-5 seems like it's supposed to be this way to drive you to yearn for better/ doing away with the boring day to day job.;The only thing I would maybe like to see different about it is to get a weekend bonus where you have a longer timer after a few days of consecutive work， or perhaps a vacation time bonus or something to manage with the day job as another way to break up the mind numbing nature of it.;;All around the flavor of this game is fantastic and I would recommend play to anyone that likes card style games.,2022-08-02 09:42:01,2022-08-02 09:42:01,True,3,0,0.568932414054870605,0,True,False,False,False,,763,False,,
76561198372249560,233,82,107,0,107,2022-08-01 17:20:05,119904416,english,Meh， nothing special. It's the usual Rules Lasagna that all "deep and rich" card games devolve into. I wouldn't even write this review except for some reason I thought I had a demo， and didn't play the game in time to refund it; so this is my revenge. Wish I'd bought Inscryption instead.,2022-08-02 05:48:36,2022-08-02 06:09:17,False,3,0,0.469300419092178345,0,True,False,False,False,,288,True,,
76561198034609553,409,151,65,0,65,2022-06-11 22:09:54,119877622,english,https://youtu.be/JeGey_Uog1k,2022-08-01 19:55:49,2022-08-01 19:55:49,True,0,0,0,0,False,True,False,False,,28,False,,
76561198392570731,51,9,2448,0,1162,2023-04-05 15:43:55,119877260,schinese,全神贯注玩起来根本感觉不到时间的流逝,2022-08-01 19:46:21,2022-08-01 19:46:21,True,0,0,0,0,False,False,False,False,,18,False,,
76561198046637344,686,176,1581,0,549,2022-09-06 21:39:35,119865786,schinese,一般。卡牌效果语焉不详都要自己试，后期大量卡牌处理频繁暂停体验不佳。虽然有一定特色，但不建议看评测入手，需要入手请先看UP们的游戏视频看自己能否接受，同时了解这个游戏的基本操作，不然根本就不明白游戏流程为什么不能推进。,2022-08-01 14:08:35,2022-08-01 14:08:35,False,0,0,0,0,False,False,False,False,,109,False,,
76561198892606417,356,37,990,0,990,2022-08-01 00:52:50,119833213,english,I have no idea what I'm doing,2022-08-01 00:53:07,2022-08-01 00:53:07,True,6,7,0.576923072338104248,0,True,False,False,False,,29,False,,
76561198100281087,74,33,297,0,201,2022-08-04 08:28:32,119823421,english,It's good， requiring a lot of micromanagement but also awarding creativity in how you think to some degree. There's a ton to keep track of and this may annoy people who don't like to do heavy resource management. The constantly evolving and always different storyline is well written， and different characters play differently.,2022-07-31 21:35:02,2022-07-31 21:35:02,True,0,0,0,0,False,False,False,False,,327,False,,
76561198165808780,167,25,1027,0,1004,2022-08-01 10:38:16,119817798,schinese,一开始玩起来还挺新鲜，玩到后面就像在上班,2022-07-31 19:27:15,2022-07-31 19:27:15,False,3,0,0.554794549942016602,0,False,False,False,False,,20,False,,
