steamid,num_games_owned,num_reviews,playtime_forever(min),playtime_last_two_weeks(min),playtime_at_review(min),last_played,recommendationid,language,review,timestamp_created,timestamp_updated,voted_up,votes_up,votes_funny,weighted_vote_score,comment_count,steam_purchase,received_for_free,written_during_early_access,hidden_in_steam_china,steam_china_location,review_length,review_updated,timestamp_dev_responded, developer_response
76561198028709564,108,18,2464,0,2464,2023-01-22 02:23:03,137707700,english,I haven't beaten this yet， but it is a great game. I don't know anything else quite like it and it makes it hard to describe. It is a card game， time is a factor， there is no rule book. Pro tip- don't work at the office too long without getting promoted.,2023-05-03 09:12:17,2023-05-03 09:12:17,True,0,0,0,0,True,False,False,True,,254,False,,
76561198034853954,799,63,1852,1852,1852,2023-05-03 05:50:03,137700997,english,The thing that will kill you is the lack of distinction between deadly and harmless things. Bleak Thoughts 1 looks the same as Bleak Thoughts Instakill， and for good measure could have spawned in a corner off screen.,2023-05-03 05:58:10,2023-05-03 05:58:10,False,0,0,0,0,False,False,False,True,,216,False,,
76561198321412600,226,15,1584,1584,1341,2023-05-03 03:25:08,137673647,schinese,密教模拟器(x);007社畜打工模拟器(√);桌面整理模拟器(√);;前期试错作死探索的时候最欢乐，中后期得重复下副本入梦刷有点坐牢，主要是刷的过程纯看脸，也不会发生什么随机事件比较无聊。多周目躲不掉的重复积累过程让坐牢感更明显了。;明明手下教徒各类人材十几号，却只能让教主搬砖水论文赚钱供教徒全世界旅游这河里吗,2023-05-02 20:19:38,2023-05-02 20:19:38,False,1,0,0.523809552192687988,0,False,False,False,True,,156,False,,
76561198021172451,256,39,1946,1946,1131,2023-05-03 05:30:13,137597672,english,It has it's talons deep in me and I don't think I can get away. 10/10,2023-05-01 13:23:04,2023-05-01 13:23:04,True,0,0,0,0,True,False,False,True,,69,False,,
76561199091909357,104,5,5291,910,5006,2023-05-02 19:28:05,137594231,schinese,剧情丰富，体验不错，但是开局内容重复。有时候很看运气,2023-05-01 11:34:37,2023-05-01 11:34:37,True,0,0,0,0,True,False,False,True,,26,False,,
76561198006230780,148,10,1161,0,1161,2022-11-18 20:52:58,137588685,english,Brutally difficult， you will die， often. You will win unsatisfactorily， often unexpectedly. You may build a powerful cult only to have it all come undone in a quick series of unfortunate cards. You can end up sabotaging yourself by choosing incompatible upgrade paths and find your path forwards forever barred. Most of the game is spent watching timers tick down while you try to keep your list of future actions in mind. ;It's enough to make you die from dread.;It is however captivating. ;The lore and setting is full Lovecraftian. If you unironically enjoy the process of sorting large numbers of things， it can be very pleasing to get a good system perfectly laid out. On that note I wish some of the card moving and stacking mechanics worked a bit better. ;Recommended， but know the price you pay.,2023-05-01 09:05:52,2023-05-01 09:05:52,True,0,0,0,0,True,False,False,True,,803,False,,
76561198062323065,384,9,163,0,163,2023-03-11 20:17:36,137579413,english,Best Indie game ever.,2023-05-01 05:32:26,2023-05-01 05:32:26,True,0,0,0,0,True,False,False,True,,21,False,,
76561199349733811,2,1,1950,270,1829,2023-05-02 00:30:16,137562487,schinese,给朋友推荐了这个游戏，他比我更喜欢玩这个游戏,2023-05-01 00:36:17,2023-05-01 00:36:17,True,0,0,0,0,True,False,False,True,,22,False,,
76561199074719618,39,6,5152,29,5123,2023-04-30 10:56:24,137523939,schinese,我是傻逼,2023-04-30 10:22:55,2023-04-30 10:22:55,True,0,0,0,0,True,False,False,True,,4,False,,
76561198081058052,62,12,11371,11371,8722,2023-05-03 09:02:10,137517260,english,To be fair， you have to have a very high IQ to understand Cultist Simulator.,2023-04-30 07:33:43,2023-04-30 07:33:43,True,0,1,0,0,True,False,False,True,,76,False,,
76561198061896831,470,44,43,18,43,2023-04-30 05:51:41,137513683,english,Pretentious nonsense "game" that would insist on being called a film if it were a movie. ;;The not having a tutorial is a bad sign， but it's not a deal breaker. What is a deal breaker is that nothing engaging happens to make me care to figure out the game. Lots of people (although not myself) had issues with their devs previous game Sunless Sea because it wasn't the exploring/trading game they wanted. It was a story driven game where you did explore the world， but none of the ship-captain-game tropes applied. to it. ;;The problem here is that it dispenses with the story which means there's no real reason to do the work to figure out the game. I'm not going to eat bowl after bowl of plain oatmeal just in case there's a steak later， and when I feel like playing a game where the devs hid the good stuff I'll just fire up Hidden Folks.,2023-04-30 06:11:08,2023-04-30 06:11:08,False,1,0,0.452436178922653198,0,False,False,False,True,,842,False,,
76561198116786278,168,3,22786,1755,22634,2023-05-02 18:27:23,137463154,english,One of my favorite games I've ever played. Incredible writing mixes with minimalist story-telling to create an infinitely deep well of mystery and intrigue. Fair warning， however: this is also perhaps the hardest game I've ever played. The mechanics are intricate and delicate， requiring an incredible amount of skill and patience. Now， having beat it 30+ times， it's become a comfort game for me， and I've come back to it again and again after years of playing. Listen to the opening scrawl: "You won't always know what to do next. Keep experimenting， and you'll master it.",2023-04-29 13:31:46,2023-04-29 13:31:46,True,0,0,0,0,True,False,False,True,,575,False,,
76561199058723580,75,23,389,38,351,2023-04-28 20:17:10,137415914,schinese,你就算管了数十人，最后你也只是在收拾桌子,2023-04-28 19:33:54,2023-04-28 19:33:54,True,1,0,0.52173912525177002,0,True,False,False,True,,20,False,,
76561198081514088,546,29,2038,2038,1341,2023-05-01 12:55:38,137403957,english,This game is fantastic. A real gem. Had a blast learning mechanics and all the weird funky interactions you can do. Had real fun assembling my cult team Ocean 11 style while keeping it on the DL from the Dream Police. One of my character's occult research was financed entirely by sugar daddies lmao. I don't want to spoil any mechanics so I'll leave it at that but make sure not to look up any guides and just explore the game on your own. You will get a real kick out of it if you like Lovecraftian story telling. Gifted it to my friend too hehe. Gotta spread the love.,2023-04-28 13:18:21,2023-04-28 13:18:21,True,0,0,0,0,True,False,False,True,,571,False,,
76561198377638527,134,56,450,0,450,2023-04-15 19:34:51,137368764,schinese,让人怀疑人生，怀疑现实世界的游戏，慎玩。,2023-04-27 21:12:56,2023-04-27 21:12:56,True,0,0,0.48245614767074585,0,False,False,False,True,,20,False,,
76561198273315136,116,2,4678,1290,4557,2023-04-28 00:01:45,137363015,schinese,一款杀时间，电波系的rogue向卡牌游戏，推荐给有足够时间且对神秘学有些许兴趣的玩家;虽然是一款以类克苏鲁风格为背景做世界观的游戏，但其游戏本身并无任何类克苏鲁风格的恐怖元素 [strike] 可以放心大胆挖掘游戏内秘史设定并入迷 [/strike];游戏中最关键且有趣的部分在于探索，这一过程在对游戏了解越少的时候是越有趣的，但也因为对游戏了解不足，极其容易出现反复bed end的情况，需要足够的耐心与兴趣支撑 [spoiler] 或者可以去问万能的wiki [/spoiler] [spoiler] 毕竟游戏内几乎没有任何形式的引导 [/spoiler];一些不涉及游戏内剧透的小技巧，如果你刚刚游玩这款游戏，且总是莫名其妙的bed end导致没办法继续进行游戏不妨点开看看;[spoiler] 1.游戏内所有卡牌与卡槽都具有属于自己的“性相”拥有与卡槽相同性相的卡牌才能放进卡槽，如果你不知道自己能做什么，不妨看看有哪些卡槽的性相与手牌相同 [/spoiler];[spoiler] 2.游戏内部分卡牌具有时限，如果你想用这些有时限的卡去做某些事但时间来不及，不妨把它拖进可用的卡槽中，开着卡槽界面继续游戏试试 [/spoiler];[spoiler] 3.如果你因为一些操作失误而出现和原本预期大相径庭的结果，不妨试试ctrl+~，这是游戏内置的工作台，你甚至可以用它作弊（不推荐，这会失去游戏内很大一部分的乐趣） [/spoiler],2023-04-27 18:13:32,2023-04-27 18:13:32,True,0,0,0,0,True,False,False,True,,623,False,,
76561199120809757,8,1,1644,35,1644,2023-04-27 16:36:47,137360608,schinese,游玩门槛高，很长一段世界才能玩懂，刚开始玩几乎泡在维基百科里看攻略，但非常有趣！设定庞大，需要慢慢体会这光怪陆离的世界观！,2023-04-27 16:39:47,2023-04-27 16:39:47,True,0,0,0,0,True,False,False,True,,61,False,,
76561197961692104,72,17,1500,1500,554,2023-05-01 02:03:10,137324925,english,Awesome replay style. A good venture for a dark heart.,2023-04-26 22:35:37,2023-04-26 22:35:37,True,0,0,0,0,True,False,False,True,,54,False,,
76561198203313065,124,7,188,37,188,2023-04-26 00:07:53,137321165,schinese,学会拖动卡牌上班了吧？很好，接下来试着飞升吧！,2023-04-26 21:07:15,2023-04-26 21:07:15,True,1,0,0,1,False,False,False,True,,23,False,,
76561198076449678,69,6,4403,278,4124,2023-05-01 23:58:41,137304971,english,Whew， Cultist Simulator has one of the steepest learning curves of any game I've ever played， and I've only "won" like twice， but damn it's fun. Fun? Soothing might be a good way to put it. The music is great， too.,2023-04-26 10:47:23,2023-04-26 10:47:23,True,0,0,0,0,True,False,False,True,,214,False,,
76561199022412019,15,3,1412,772,839,2023-04-30 11:48:49,137252782,english,Very fun， loved exile.,2023-04-25 08:55:50,2023-04-25 08:55:50,True,0,0,0,0,True,False,False,True,,22,False,,
76561198101466447,638,25,2718,667,2339,2023-04-25 23:21:23,137224097,schinese,这类值得深入研究的游戏真的不多,2023-04-24 20:51:47,2023-04-24 20:51:47,True,0,0,0,0,True,False,False,True,,15,False,,
76561198336290576,290,24,1704,1548,1704,2023-04-24 19:12:50,137221325,schinese,优点：极为优秀的本地化文本，宏大而诡谲的神秘学世界，前期丰富的探索感;;缺点：中后期重复度高，流程引导极为晦涩（不过引导晦涩这一点算是文本优秀代入感强的负面效应），每轮游戏时间过长，不方便后期探索路线，并且无明显节点导致玩起来容易疲惫;;28h打了灯教小胜（灯教当时不会玩创的是启教所以二周目开局就没办法玩下去很气）、铸教小胜、铸教大胜三个结局，现在已经完全疲惫了，中途反复想着呜呜呜打一次大胜结局就不想再玩了累死了;;对阅读不排斥、对神秘学感兴趣、有耐心的玩家非常建议入手体验一下。新手玩不懂看教学估计也很懵，可以自己探索一段时间之后看看wiki，挺方便的;哦对了，笔记本的小屏幕玩起来好痛苦！玩的时候一直想着要是我也有大屏幕就好了TAT,2023-04-24 19:31:43,2023-04-24 19:31:43,True,1,0,0.523809552192687988,0,True,False,False,True,,320,False,,
76561198968662566,96,4,3876,886,3519,2023-04-27 19:19:52,137157959,schinese,推荐购买，上手比较难，但是熟悉后挺有趣,2023-04-23 15:44:07,2023-04-23 15:44:07,True,0,1,0,0,False,False,False,True,,19,False,,
76561199035563409,45,2,9270,5490,6934,2023-04-26 00:55:43,137153180,schinese,非常好玩，非常上头，非常策略，唯一就是这个游戏很解谜，对萌新没有任何教程，但是游戏是好游戏，就是每开一把都要玩很久，特别前期拉三维，招人和买书要很久，但是每开一把都很上瘾，还有各种各样的成就和结局，有时候为了拿某个成就会故意死一把，因为萌新玩几把基本就会了不容易死，但是有些成就需要失败解锁，但是赢一把要很长时间，除了基础那几个开局好一点，DLC拓展包的玩法真的是又麻烦又浪费时间，但是好玩就完了，建议打折入手，我是之前打折买的五折还是六折买的，原价买感觉有点小贵，因为这个游戏要买全，没有DLC的开局很平淡，DLC会增加其他开局，其他飞升方式，和特定的故事和各种结局,2023-04-23 13:11:01,2023-04-23 13:11:01,True,1,0,0.523809552192687988,0,False,False,False,True,,284,False,,
76561197999666315,260,11,3915,3915,3091,2023-04-24 10:12:29,137139736,english,yes,2023-04-23 06:38:57,2023-04-23 06:38:57,True,0,0,0,0,True,False,False,True,,3,False,,
76561198317128927,92,32,37,5,32,2023-04-24 21:15:38,137095509,english,Very interesting game,2023-04-22 14:58:46,2023-04-22 14:58:46,True,0,0,0,0,False,False,False,True,,21,False,,
76561198290312969,187,26,4625,786,4621,2023-04-29 00:07:56,137045270,schinese,说实在的，这个世界观做成游戏有点屈尊，合成大秘传+梦里抽卡+凑属性点，玩多了也就那样，套路都是固定的。;如果能展开来写成小说的话就好了，洋人修仙(飞升)传，谁不想看啊。,2023-04-21 17:41:57,2023-04-21 17:41:57,True,1,0,0.444444417953491211,0,True,False,False,True,,84,False,,
76561198816365354,231,33,11409,1944,11005,2023-05-02 14:37:53,136998129,schinese,玩法单调枯燥但内核寓意无穷，每一步操作都似果肉饱含汁水般饱含着可能性。;;致所有初涉密教的教主们：你不会总是能够得知下一步该做什么。不断尝试吧，你会掌握其中奥妙的。,2023-04-20 18:56:58,2023-04-29 14:09:41,True,1,0,0,1,False,False,False,True,,82,True,,
76561198990445364,33,1,2617,0,2571,2023-04-17 09:04:01,136834442,english,I've been playing for a few years and no matter what occurrences happen in the real world this game keeps calling me. In my dreams. In visions. This fascination will consume you as it did me.,2023-04-17 08:21:27,2023-04-17 08:21:27,True,0,0,0,0,True,False,False,True,,191,False,,
76561198014227075,106,74,2402,1253,298,2023-04-27 16:00:05,136793038,english,Its a puzzle game with little timers attached to them and that requires figuring out the proper sequences to get to the desired end of the story. The thing about the timers though is that there is a pause button， so if a person wants to read the story attached to the cards they can just pause. Having a pause button defeats the purpose of the timer and it does not make sense to me.;;I am OK with skipping the rest of the game.,2023-04-16 17:28:26,2023-04-16 17:28:26,False,1,0,0.373137116432189941,0,True,False,False,True,,428,False,,
76561198133817271,529,12,2006,0,2006,2022-06-17 23:33:16,136790929,schinese,好玩，对味。风格独特精致，玩法有趣有创意，游戏内容丰富有深度，文本翻译精巧又晦涩。;;在桌面上体验一个为了生计上班的普通打工仔，一步步探索秘闻，成立密教，培养信徒，进行仪式，最终飞升的故事。;游戏提供了8种各不相同的秘传路线，以及多种胜利结局，足以让每次的游戏都有新的玩法。;美中不足是游戏中后期的流程比较重复。,2023-04-16 16:33:45,2023-04-16 16:33:45,True,2,0,0,1,True,False,False,True,,156,False,,
76561198845924353,103,6,1695,88,1174,2023-05-01 15:03:58,136786296,schinese,非常杀时间，非常上头,2023-04-16 14:19:35,2023-04-16 14:19:35,True,0,0,0,0,True,False,False,True,,10,False,,
76561198197285733,490,93,2189,0,2189,2023-04-15 23:45:02,136780275,tchinese,很多_局都有正常人生的Y局，J真工作，安一生，@在[蛑K不困y。;那N，是什N使你追求超凡的w升之路？;遵循j望，探索秘密，躲避追，提升自我，直到跨^凡人的界，@就是密教模M器特e的主}。;@是困y的道路，H上你完全]有路耍[虿惶峁┬率纸W，_局直接把自己死或迷失自我都是常有的，在常世中跌跌撞撞也是N[蝮w的啡ぁ;[虻夥辗浅：茫D/文字/事件O都非常有神z感，m然美g演出相ι伲大多是卡牌，但夥盏轿唬一桌子就道M精彩的故事。;但一定要提一下，太漫L了，一局LY局淼搅10小r+，你熟知世之道，後面就化不大，作I感很重。;我o好u，只是我再也]有精力展_另一次求道之旅了，穿越白之T消耗了我的w力，我的容器已疲冢精神t化樵u淼搅诉@e。,2023-04-16 11:24:20,2023-04-16 11:26:49,True,1,0,0,0,False,False,False,True,,344,True,,
76561199014161878,11,2,3223,1178,1951,2023-05-02 16:25:10,136750407,schinese,如果一个人没有通关异教徒模拟器，那么他应该会度过一个略带遗憾的人生。,2023-04-16 00:21:37,2023-04-16 00:21:37,True,1,0,0,0,False,False,False,True,,34,False,,
76561198821527743,143,9,2848,0,2848,2023-04-15 17:27:25,136740183,schinese,好游戏,2023-04-15 21:19:24,2023-04-15 21:19:24,True,0,0,0,0,True,False,False,True,,3,False,,
76561198271633809,60,6,919,0,919,2023-01-07 05:24:48,136711404,english,симулятор работника 5/2， оценка такая же,2023-04-15 08:38:33,2023-04-15 08:38:33,True,1,0,0.523809552192687988,0,True,False,False,True,,40,False,,
76561198978125717,159,12,749,0,639,2023-04-14 23:46:34,136681846,schinese,如果你是来追求华丽的战斗与精美的画面，那么这款游戏并不适合你。;如果你喜欢神秘学与阅读文字，这绝对是打发时间的不二之选。,2023-04-14 21:56:46,2023-04-14 21:56:46,True,0,0,0,0,True,False,False,True,,60,False,,
76561198150984024,126,2,4718,0,4718,2022-12-14 21:03:22,136648637,english,A very good design for a experience， where your mind is freed from all that is known， and your walls are torn down. You shall fall， you shall fail， and in the visions of your past， you will find the glimmer of victory. You shall burn eternal， you shall see light forever， you shall thirst forever.;Buy this game if you want to learn how to write deep metaphors with a pinch of dread. And also cards.,2023-04-14 05:27:38,2023-04-14 05:27:38,True,0,1,0,0,True,False,False,True,,399,False,,
76561199353834184,24,2,735,0,735,2023-04-13 21:44:30,136627450,schinese,召异神，逐忌宝。奉信条，创密教。;被抛入一个卡牌组成的世界，你手上只拥有 （卑贱的工作）和（理性）两个选择。;向卡池投掷卡牌，从事「卑贱的工作」，搬砖容易失去 「健康」，陷入疾病威胁。投入「理性」，你会找到一份轻松点的文职工作，但一不小心就成会 996 的社畜。;两个选择都不是完美的选项，何况金钱还会时刻随着时间流逝。;这个世界最大的意外来自一份密教的断章，密语写成，艰涩万分。即使没有完全看懂，里面神异却开始扰乱你的思维。教义、仪式、传说中的神明低语，恐惧情绪主宰你的精神，你不得不到书店和拍卖行寻找更多的书籍来解读。;你不断和周围的熟人谈论它，变得举止神秘，行踪可疑，以至于警察盯上了你，断章的蛛丝马迹爬满生活。;不被黑暗同化，就被黑暗吞噬。但谁知道，被同化是不是被吞噬的一种方式？对恶龙的恐惧让人成为恶龙本身。作为一个 996 打工仔，你悲剧地发现你的宿命是应神的启示，建立密教，召集信徒，对抗你的敌人。;一次次入梦，在漫宿中惊鸿一瞥，在超脱的道路上越升越高。;最终成就飞升，超越启示本身，甚至为后进者指引道路。;,2023-04-13 21:58:26,2023-04-13 21:58:26,True,2,0,0,0,True,False,False,True,,461,False,,
76561198022495126,288,8,1716,0,1716,2020-01-03 23:59:21,136605594,english,I know my hours played are only 28， but I've got nearly 100 on the mobile game. This game deserves way more attention than it has gotten， genuine gem. Lots of reading， but it is worth your time.,2023-04-13 10:00:21,2023-04-13 10:00:21,True,0,0,0,0,True,False,False,True,,194,False,,
76561198193397001,175,28,2226,0,2226,2022-11-14 05:43:18,136554014,english,honestly， I don't understand anything that's going on， but I like when number go up and timer do down,2023-04-12 10:09:18,2023-04-12 10:09:18,True,3,1,0.545454561710357666,0,True,False,False,True,,101,False,,
76561198055380308,233,14,2906,0,2465,2023-04-12 13:00:11,136504486,english,This game will lead you down a winding path of obsession. Fleeting messages of queer content and queerer arrivals will stick in your mind， accumulating in splatters and starts， until its plaster edifice renders itself legible. In that moment you are enlightened， and you ask: "Damn， why do I have to start every run grinding?",2023-04-11 10:46:38,2023-04-11 10:46:38,True,1,0,0,0,True,False,False,True,,326,False,,
76561198066424544,273,3,6265,0,6172,2023-04-12 14:16:59,136499437,english,I murdered my rival who was investigating me. Then I re-animated their corpse to be my follower and sent them on a mission to destroy all the evidence they had built against me. ;;10 / 10,2023-04-11 08:10:43,2023-04-11 08:10:43,True,9,1,0.625668466091156006,0,True,False,False,True,,187,False,,
76561197989454657,184,2,3882,24,3857,2023-04-22 23:18:05,136466998,english,One of my favorite games. Amazing now a card game can tell a deep story.,2023-04-10 20:24:44,2023-04-10 20:24:44,True,0,0,0,0,True,False,False,True,,72,False,,
76561198834411210,291,57,6521,0,6521,2023-04-01 18:50:45,136460749,schinese,评测犹在影中,2023-04-10 17:36:45,2023-04-10 17:36:45,True,0,0,0,0,True,False,False,True,,6,False,,
76561199208569744,76,7,89,0,89,2022-09-10 18:48:31,136442770,schinese,神中神，手机上玩了几十个小时，无论是卡牌元素还是密教元素都是顶尖，文案更是一绝。游戏过程不推荐查攻略，探寻未知的过程才是这个游戏的最大乐趣。,2023-04-10 07:55:46,2023-04-10 07:56:26,True,3,0,0.53947371244430542,0,False,False,False,True,,70,True,,
76561198010236861,1139,12,2011,0,2011,2019-07-10 06:04:11,136428682,english,I love this game's writing. I love this game's art. I love the sense of unfolding discovery and exploration， the way that the tone of the game escalates as you dig yourself deeper. Cultist Simulator doesn't so much build a world as burn it into the blank slate of the card table， creating scorch marks and lightning trees that gesture at occult secrets. It really does feel like you're snatching revelations from your dreams and taking them back to the world and using them to turn people into zealous followers.;;That said， after hours and hours of unwinding and digging and burning... I found what was under all that work pretty empty. I won't get into the specific mechanics in case you still want to discover them， but the game is fundamentally about time management and keeping plates spinning， but I kept feeling like I didn't have enough control over those plates. The game expects you to grind and grind and build up resources gradually， but also expects you to start all over when an unlucky break makes you lose everything - a recipe in redundancy and repetition. And that's not really for me.,2023-04-10 03:02:43,2023-04-10 03:02:43,False,15,0,0.69802933931350708,0,False,False,False,True,,1103,False,,
76561199001030166,92,51,2012,66,1841,2023-05-02 05:35:23,136397554,schinese,[h1]密教模拟器是一个时刻令玩家充满探索欲望的文字冒险游戏[/h1];;优点：;-精简的卡牌与ui;-庞大的文字量，本地化中文将原版怪诞神秘的克苏鲁风格展现的淋漓尽致;-[strike]骨子里的反社会[/strike];缺点：;-中后期少量的重复性;-缺少指引;[spoiler]-过多的成就[/spoiler];;这款游戏对于密教，邪典爱好者来说不可多得，得益于作者优秀的文笔，我也确实一次又一次的体会到了探索的乐趣，就像作者在采访中所说，这款游戏没有一秒钟的cg，因为他不需要，他每时每刻都在用不同的方式向我们讲述隐藏在游戏后的故事。可以看的出制作者尽可能的减少了重复性，不过缺少指引也导致了重复性的必然发生。我在游戏过程中不可抗力的搜索了攻略，搜索的同时减少了很多乐趣。不建议查攻略。;;评分：;9/10,2023-04-09 16:26:30,2023-04-09 16:26:30,True,2,0,0,0,True,False,False,True,,356,False,,
76561199488553927,16,3,1089,0,864,2023-04-11 19:11:39,136387009,schinese,时间大杀手，想买的注意这个。好玩是真的好玩。,2023-04-09 11:32:47,2023-04-09 11:32:47,True,0,0,0,0,True,False,False,True,,22,False,,
76561198366416753,28,6,937,84,826,2023-04-24 11:39:43,136386510,english,It's a fun game for people who are good at thinking and planning ahead. The best thing about it is honestly just how it teaches you what to do. Every failure is never actually a failure， but a lesson that'll take you further next time. It never gets boring， since it keeps you on your toes at all times， and it's bound to get you hooked. Definitely buy and play， if you like tabletop strategy games.,2023-04-09 11:19:40,2023-04-09 11:19:40,True,2,0,0.509971141815185547,0,True,False,False,True,,399,False,,
